{
  "acceptance_tests": [
    "No new survival-critical unmet demand is introduced.",
    "No labor is shifted into untracked resident burden.",
    "Privacy, consent, public-health, accessibility, and governance assumptions remain explicit."
  ],
  "focus_domain": "water_public_health",
  "id": "patch_water_public_health_recovery_playbook_v0_enriched",
  "implementation_notes": [
    "Patch proposal is an implementation intent artifact, not an automatic mutation.",
    "Model changes should be applied through a dedicated promotion command after simulation comparison.",
    "Water recovery can move from blocked to testable if source isolation, alternate supply, lab testing, and release authority are modeled explicitly against baseline labor availability and governance warnings."
  ],
  "kind": "PatchProposal",
  "model_changes": [
    {
      "from": false,
      "path": "capabilities.water_public_health.tracked_interventions.water_public_health_recovery_playbook_v0_enriched",
      "provisional": true,
      "rationale": "Make the candidate intervention explicit in the capability layer before promotion.",
      "to": true
    },
    {
      "from": null,
      "path": "candidate_effects.water_public_health_recovery_playbook_v0_enriched.scenario_blocked_review_domain_count",
      "provisional": true,
      "rationale": "Explicit modeling of authority and isolation unblocks recovery review.",
      "to": "decrease"
    },
    {
      "from": null,
      "path": "candidate_effects.water_public_health_recovery_playbook_v0_enriched.resource_telemetry_labor_required_minutes_per_resident_per_day",
      "provisional": true,
      "rationale": "Modeling authority testing requires explicit labor allocation rather than shifting to resident burden.",
      "to": "increase"
    },
    {
      "from": null,
      "path": "candidate_effects.water_public_health_recovery_playbook_v0_enriched.capabilities_domain_statuses_governance_anticapture",
      "provisional": true,
      "rationale": "Does not assume emergency power sunset is defined; leaves governance warnings explicit.",
      "to": "neutral"
    }
  ],
  "provisional": true,
  "simulation_checks": [
    "water_contamination_response_v2",
    "resource_telemetry.labor.required_minutes_per_resident_per_day",
    "capabilities.domain_statuses",
    "scenario.blocked_review_domain_count"
  ],
  "source_candidate_id": "water_public_health_recovery_playbook_v0_enriched",
  "source_loop_id": "discovery_civic_floor_730_v0_pop_730_water_public_health_v0",
  "status": "needs_evidence",
  "target": {
    "artifact": "scenarios/water_public_health_recovery_playbook_v0_enriched.yaml",
    "change_type": "add_scenario_playbook"
  },
  "title": "Water recovery test-and-release playbook with labor governance",
  "validation": {
    "blocking_reasons": [],
    "schema_valid": true,
    "warnings": [
      "Assumption requires evidence: assumption_labor_baseline",
      "Assumption requires evidence: assumption_governance_check"
    ]
  },
  "version": "v0"
}
