{
  "acceptance_tests": [
    "No new survival-critical unmet demand is introduced.",
    "No labor is shifted into untracked resident burden.",
    "Privacy, consent, public-health, accessibility, and governance assumptions remain explicit."
  ],
  "focus_domain": "care_health",
  "id": "patch_care_health_critical_load_medication_cold_chain_cabinet_v1",
  "implementation_notes": [
    "Patch proposal is an implementation intent artifact, not an automatic mutation.",
    "Model changes should be applied through a dedicated promotion command after simulation comparison.",
    "A small critical-load cold-chain cabinet can protect temperature-sensitive medication during outage and illness-wave scenarios."
  ],
  "kind": "PatchProposal",
  "model_changes": [
    {
      "from": false,
      "path": "capabilities.care_health.tracked_interventions.care_health_critical_load_medication_cold_chain_cabinet_v1",
      "provisional": true,
      "rationale": "Make the candidate intervention explicit in the capability layer before promotion.",
      "to": true
    },
    {
      "from": null,
      "path": "candidate_effects.care_health_critical_load_medication_cold_chain_cabinet_v1.critical_load_energy_draw",
      "provisional": true,
      "rationale": "Generated hypothesis expects critical_load_energy_draw to increase.",
      "to": "increase"
    },
    {
      "from": null,
      "path": "candidate_effects.care_health_critical_load_medication_cold_chain_cabinet_v1.medication_spoilage_risk",
      "provisional": true,
      "rationale": "Generated hypothesis expects medication_spoilage_risk to decrease.",
      "to": "decrease"
    },
    {
      "from": null,
      "path": "candidate_effects.care_health_critical_load_medication_cold_chain_cabinet_v1.maintenance_burden",
      "provisional": true,
      "rationale": "Generated hypothesis expects maintenance_burden to increase.",
      "to": "increase"
    }
  ],
  "provisional": true,
  "simulation_checks": [
    "scenario_illness_wave",
    "water_contamination_response_v2",
    "resource_telemetry.labor.required_minutes_per_resident_per_day",
    "capabilities.domain_statuses",
    "scenario.blocked_review_domain_count"
  ],
  "source_candidate_id": "care_health_critical_load_medication_cold_chain_cabinet_v1",
  "source_loop_id": "discovery_civic_floor_80_v0_pop_80_care_health_v0",
  "status": "needs_evidence",
  "target": {
    "artifact": "tech_modules/care_health_critical_load_medication_cold_chain_cabinet_v1.yaml",
    "change_type": "add_module"
  },
  "title": "Critical-load medication cold-chain cabinet",
  "validation": {
    "blocking_reasons": [],
    "schema_valid": true,
    "warnings": [
      "Assumption requires evidence: assumption_2_local_fit",
      "Assumption requires evidence: assumption_3_energy"
    ]
  },
  "version": "v0"
}
