{
  "acceptance_tests": [
    "No new survival-critical unmet demand is introduced.",
    "Privacy, consent, public-health, accessibility, and governance assumptions remain explicit."
  ],
  "focus_domain": "water_public_health",
  "id": "patch_water_public_health_governance_patch_v0",
  "implementation_notes": [
    "Patch proposal is an implementation intent artifact, not an automatic mutation.",
    "Model changes should be applied through a dedicated promotion command after simulation comparison.",
    "Defining due process and emergency power sunset explicitly reduces governance_anticapture warnings."
  ],
  "kind": "PatchProposal",
  "model_changes": [
    {
      "from": false,
      "path": "capabilities.water_public_health.tracked_interventions.water_public_health_governance_patch_v0",
      "provisional": true,
      "rationale": "Make the candidate intervention explicit in the capability layer before promotion.",
      "to": true
    },
    {
      "from": null,
      "path": "candidate_effects.water_public_health_governance_patch_v0.governance_anticapture_status",
      "provisional": true,
      "rationale": "Generated hypothesis expects governance_anticapture status to decrease or resolve warnings.",
      "to": "decrease"
    },
    {
      "from": null,
      "path": "candidate_effects.water_public_health_governance_patch_v0.blocked_review_domain_count",
      "provisional": true,
      "rationale": "Generated hypothesis expects blocked_review_domain_count to decrease.",
      "to": "decrease"
    }
  ],
  "provisional": true,
  "simulation_checks": [
    "water_contamination_response_v2",
    "capabilities.domain_statuses",
    "scenario.blocked_review_domain_count"
  ],
  "source_candidate_id": "water_public_health_governance_patch_v0",
  "source_loop_id": "discovery_civic_floor_730_v0_pop_730_water_public_health_v0",
  "status": "needs_evidence",
  "target": {
    "artifact": "patterns/water_public_health/water_public_health_governance_patch_v0.yaml",
    "change_type": "update_pattern"
  },
  "title": "Governance process definition patch",
  "validation": {
    "blocking_reasons": [],
    "schema_valid": true,
    "warnings": [
      "Assumption requires evidence: assumption_5_process_definition",
      "Assumption requires evidence: assumption_6_accessibility"
    ]
  },
  "version": "v0"
}
