{
  "acceptance_tests": [
    "No new survival-critical unmet demand is introduced.",
    "No labor is shifted into untracked resident burden.",
    "Privacy, consent, public-health, accessibility, and governance assumptions remain explicit."
  ],
  "focus_domain": "mobility_access",
  "id": "patch_mobility_access_review_process_draft_v0",
  "implementation_notes": [
    "Patch proposal is an implementation intent artifact, not an automatic mutation.",
    "Model changes should be applied through a dedicated promotion command after simulation comparison.",
    "Accessibility claims require explicit due process definition and emergency power sunset definition before promotion."
  ],
  "kind": "PatchProposal",
  "model_changes": [
    {
      "from": false,
      "path": "capabilities.mobility_access.tracked_interventions.mobility_access_review_process_draft_v0",
      "provisional": true,
      "rationale": "Make the candidate intervention explicit in the capability layer before promotion.",
      "to": true
    },
    {
      "from": null,
      "path": "candidate_effects.mobility_access_review_process_draft_v0.governance_anticapture_status",
      "provisional": true,
      "rationale": "Addressing governance warnings may improve status from warn to pass.",
      "to": "increase"
    },
    {
      "from": null,
      "path": "candidate_effects.mobility_access_review_process_draft_v0.scenario_blocked_review_domain_count",
      "provisional": true,
      "rationale": "Explicit due process definition may unblock governance domains.",
      "to": "decrease"
    }
  ],
  "provisional": true,
  "simulation_checks": [
    "scenario_illness_wave",
    "water_contamination_response_v2",
    "resource_telemetry.labor.required_minutes_per_resident_per_day",
    "capabilities.domain_statuses",
    "scenario.blocked_review_domain_count"
  ],
  "source_candidate_id": "mobility_access_review_process_draft_v0",
  "source_loop_id": "discovery_civic_floor_730_v0_pop_486_mobility_access_v0",
  "status": "needs_evidence",
  "target": {
    "artifact": "patterns/mobility_access/mobility_access_review_process_draft_v0.yaml",
    "change_type": "add_governance_rule"
  },
  "title": "Accessibility review process draft",
  "validation": {
    "blocking_reasons": [],
    "schema_valid": true,
    "warnings": [
      "Assumption requires evidence: assumption_5_governance_warning",
      "Assumption requires evidence: assumption_6_legal_dependency"
    ]
  },
  "version": "v0"
}
