{
  "acceptance_tests": [
    "Due process is not explicitly defined warning is resolved or mitigated.",
    "Emergency power sunset is modeled explicitly."
  ],
  "focus_domain": "water_public_health",
  "id": "patch_water_governance_authority_rule_v0",
  "implementation_notes": [
    "Patch proposal is an implementation intent artifact, not an automatic mutation.",
    "Model changes should be applied through a dedicated promotion command after simulation comparison.",
    "Defining emergency power sunset and due process rules reduces governance anticapture warnings and supports water block release."
  ],
  "kind": "PatchProposal",
  "model_changes": [
    {
      "from": false,
      "path": "capabilities.water_public_health.tracked_interventions.water_governance_authority_rule_v0",
      "provisional": true,
      "rationale": "Make the candidate intervention explicit in the capability layer before promotion.",
      "to": true
    },
    {
      "from": null,
      "path": "candidate_effects.water_governance_authority_rule_v0.capabilities_domain_statuses_governance_anticapture",
      "provisional": true,
      "rationale": "Explicit definitions may resolve warn status.",
      "to": "pass"
    },
    {
      "from": null,
      "path": "candidate_effects.water_governance_authority_rule_v0.scenario_blocked_review_domain_count",
      "provisional": true,
      "rationale": "Resolving governance warnings may reduce blocked reviews.",
      "to": "decrease"
    }
  ],
  "provisional": true,
  "simulation_checks": [
    "water_contamination_response_v2",
    "governance_anticapture_v2",
    "capabilities.domain_statuses",
    "scenario.blocked_review_domain_count"
  ],
  "source_candidate_id": "water_governance_authority_rule_v0",
  "source_loop_id": "discovery_civic_floor_730_v0_pop_730_pop_238_water_public_health_v0",
  "status": "blocked",
  "target": {
    "artifact": "patterns/water_public_health/water_governance_authority_rule_v0.yaml",
    "change_type": "add_governance_rule"
  },
  "title": "Water authority sunset modeling rule",
  "validation": {
    "blocking_reasons": [
      "Source candidate does not satisfy DiscoveryCandidateIntervention schema."
    ],
    "schema_valid": false,
    "warnings": [
      "Assumption requires evidence: assumption_4_governance_process",
      "Assumption requires evidence: assumption_5_power_sunset"
    ]
  },
  "version": "v0"
}
