{
  "acceptance_tests": [
    "Due process definitions are explicit.",
    "Emergency power sunset is defined.",
    "Accessibility routes are verified."
  ],
  "focus_domain": "water_public_health",
  "id": "patch_water_public_health_governance_audit_task_v0",
  "implementation_notes": [
    "Patch proposal is an implementation intent artifact, not an automatic mutation.",
    "Model changes should be applied through a dedicated promotion command after simulation comparison.",
    "Explicit governance definitions regarding public health visibility and accessibility must be audited to prevent blocked reviews due to compliance gaps."
  ],
  "kind": "PatchProposal",
  "model_changes": [
    {
      "from": false,
      "path": "capabilities.water_public_health.tracked_interventions.water_public_health_governance_audit_task_v0",
      "provisional": true,
      "rationale": "Make the candidate intervention explicit in the capability layer before promotion.",
      "to": true
    },
    {
      "from": null,
      "path": "candidate_effects.water_public_health_governance_audit_task_v0.capabilities_domain_statuses_governance_anticapture_status",
      "provisional": true,
      "rationale": "Explicit definitions reduce warning status to pass.",
      "to": "pass"
    },
    {
      "from": null,
      "path": "candidate_effects.water_public_health_governance_audit_task_v0.scenario_blocked_review_domain_count",
      "provisional": true,
      "rationale": "Compliance gaps identified and addressed.",
      "to": "decrease"
    }
  ],
  "provisional": true,
  "simulation_checks": [
    "water_contamination_response_v2",
    "capabilities.domain_statuses",
    "scenario.blocked_review_domain_count",
    "mobility_access"
  ],
  "source_candidate_id": "water_public_health_governance_audit_task_v0",
  "source_loop_id": "discovery_civic_floor_730_v0_pop_730_pop_155_water_public_health_v0",
  "status": "blocked",
  "target": {
    "artifact": "docs/research/water_public_health_governance_audit_task_v0.md",
    "change_type": "add_research_task"
  },
  "title": "Governance and accessibility audit task",
  "validation": {
    "blocking_reasons": [
      "Source candidate does not satisfy DiscoveryCandidateIntervention schema."
    ],
    "schema_valid": false,
    "warnings": [
      "Assumption requires evidence: assumption_3_governance"
    ]
  },
  "version": "v0"
}
