{
  "acceptance_tests": [
    "No labor is shifted into untracked resident burden.",
    "Privacy, consent, public-health, accessibility, and governance assumptions remain explicit."
  ],
  "focus_domain": "water_public_health",
  "id": "patch_water_public_health_labor_allocation_rule_v0",
  "implementation_notes": [
    "Patch proposal is an implementation intent artifact, not an automatic mutation.",
    "Model changes should be applied through a dedicated promotion command after simulation comparison.",
    "Explicitly checking hours_per_resident constraints prevents shifting labor into untracked resident burden during recovery."
  ],
  "kind": "PatchProposal",
  "model_changes": [
    {
      "from": false,
      "path": "capabilities.water_public_health.tracked_interventions.water_public_health_labor_allocation_rule_v0",
      "provisional": true,
      "rationale": "Make the candidate intervention explicit in the capability layer before promotion.",
      "to": true
    },
    {
      "from": null,
      "path": "candidate_effects.water_public_health_labor_allocation_rule_v0.labor_required_minutes_per_resident_per_day",
      "provisional": true,
      "rationale": "Generated hypothesis expects labor required minutes to not increase untracked.",
      "to": "neutral"
    },
    {
      "from": null,
      "path": "candidate_effects.water_public_health_labor_allocation_rule_v0.blocked_review_domain_count",
      "provisional": true,
      "rationale": "Generated hypothesis expects blocked_review_domain_count to decrease.",
      "to": "decrease"
    }
  ],
  "provisional": true,
  "simulation_checks": [
    "water_contamination_response_v2",
    "resource_telemetry.labor.required_minutes_per_resident_per_day",
    "capabilities.domain_statuses"
  ],
  "source_candidate_id": "water_public_health_labor_allocation_rule_v0",
  "source_loop_id": "discovery_civic_floor_730_v0_pop_730_water_public_health_v0",
  "status": "needs_evidence",
  "target": {
    "artifact": "patterns/water_public_health/water_public_health_labor_allocation_rule_v0.yaml",
    "change_type": "add_governance_rule"
  },
  "title": "Labor time allocation rule for water commons",
  "validation": {
    "blocking_reasons": [],
    "schema_valid": true,
    "warnings": [
      "Assumption requires evidence: assumption_3_labor_baselines",
      "Assumption requires evidence: assumption_4_care_health"
    ]
  },
  "version": "v0"
}
