{
  "acceptance_tests": [
    "No new survival-critical unmet demand is introduced.",
    "No labor is shifted into untracked resident burden.",
    "Privacy, consent, public-health, accessibility, and governance assumptions remain explicit."
  ],
  "focus_domain": "care_health",
  "id": "patch_care_health_care_steward_continuity_rota_v0_enriched",
  "implementation_notes": [
    "Patch proposal is an implementation intent artifact, not an automatic mutation.",
    "Model changes should be applied through a dedicated promotion command after simulation comparison.",
    "A backup care steward rota can make medication and high-need continuity visible while preventing a single role from becoming a hidden labor sink, supported by explicit labor metrics."
  ],
  "kind": "PatchProposal",
  "model_changes": [
    {
      "from": false,
      "path": "capabilities.care_health.tracked_interventions.care_health_care_steward_continuity_rota_v0_enriched",
      "provisional": true,
      "rationale": "Make the candidate intervention explicit in the capability layer before promotion.",
      "to": true
    },
    {
      "from": null,
      "path": "candidate_effects.care_health_care_steward_continuity_rota_v0_enriched.role_backup_coverage",
      "provisional": true,
      "rationale": "Generated hypothesis expects role_backup_coverage to increase.",
      "to": "increase"
    },
    {
      "from": null,
      "path": "candidate_effects.care_health_care_steward_continuity_rota_v0_enriched.hidden_labor_tracking",
      "provisional": true,
      "rationale": "Generated hypothesis expects hidden_labor_tracking to increase as per labor_time domain warning messages.",
      "to": "increase"
    },
    {
      "from": null,
      "path": "candidate_effects.care_health_care_steward_continuity_rota_v0_enriched.commons_labor_minutes",
      "provisional": true,
      "rationale": "Generated hypothesis expects commons_labor_minutes to increase due to explicit tracking.",
      "to": "increase"
    }
  ],
  "provisional": true,
  "simulation_checks": [
    "scenario_illness_wave",
    "water_contamination_response_v2",
    "resource_telemetry.labor.required_minutes_per_resident_per_day",
    "capabilities.domain_statuses",
    "scenario.blocked_review_domain_count"
  ],
  "source_candidate_id": "care_health_care_steward_continuity_rota_v0_enriched",
  "source_loop_id": "discovery_civic_floor_80_v0_pop_80_care_health_v0",
  "status": "needs_evidence",
  "target": {
    "artifact": "patterns/care_health/care_health_care_steward_continuity_rota_v0_enriched.yaml",
    "change_type": "add_operating_protocol"
  },
  "title": "Care steward continuity rota with visible labor tracking",
  "validation": {
    "blocking_reasons": [],
    "schema_valid": true,
    "warnings": [
      "Assumption requires evidence: assumption_3_local_fit_enriched",
      "Assumption requires evidence: assumption_4_governance"
    ]
  },
  "version": "v0"
}
